[
  {
    "chapter": "method",
    "facility_key": "project-bosc",
    "lead_ids": [],
    "model": {
      "id": "method",
      "facilityKey": "project-bosc",
      "status": "data",
      "statusReasons": [],
      "stats": [],
      "gaps": [],
      "caveats": []
    }
  },
  {
    "chapter": "project",
    "facility_key": "project-bosc",
    "lead_ids": [],
    "model": {
      "id": "project",
      "facilityKey": "project-bosc",
      "status": "data",
      "statusReasons": [],
      "stats": [
        {
          "label": "IT load",
          "value": "250–300",
          "unit": "MW",
          "evidence": "inference",
          "basis": "modeled",
          "sub": "bracket grounded by an instrument on the record",
          "source": "air permit (committed)",
          "warn": null
        },
        {
          "label": "Cooling",
          "value": "evaporative tower",
          "unit": null,
          "evidence": "inference",
          "basis": null,
          "sub": null,
          "source": null,
          "warn": null
        }
      ],
      "gaps": [],
      "caveats": []
    }
  },
  {
    "chapter": "water-supply",
    "facility_key": "project-bosc",
    "lead_ids": [
      "FORCEMAIN-MGD",
      "LIMA-WWTP-SHARE",
      "H1-DRAW"
    ],
    "model": {
      "id": "water-supply",
      "facilityKey": "project-bosc",
      "status": "data",
      "statusReasons": [],
      "stats": [
        {
          "label": "Worst-case consumptive draw",
          "value": "4.9",
          "unit": "cfs",
          "evidence": "inference",
          "basis": "modeled",
          "sub": "scenario: buildout",
          "source": "derived",
          "warn": null
        },
        {
          "label": "Receiving low flow (7Q10)",
          "value": "0.2",
          "unit": "cfs",
          "evidence": "verified",
          "basis": "grounded",
          "sub": "Ottawa River",
          "source": "document",
          "warn": null
        }
      ],
      "gaps": [],
      "caveats": [
        "The draw is set against the receiving water's cited design low flow as a worst-case, basin-scale bound — a screening comparison, not a withdrawal claim."
      ]
    }
  },
  {
    "chapter": "discharge",
    "facility_key": "project-bosc",
    "lead_ids": [
      "WWTP-PARAM-ASSIM",
      "OEPA-2DP00130"
    ],
    "model": {
      "id": "discharge",
      "facilityKey": "project-bosc",
      "status": "data",
      "statusReasons": [],
      "stats": [
        {
          "label": "Tightest chronic dilution",
          "value": "0.0×",
          "unit": null,
          "evidence": "verified",
          "basis": "grounded",
          "sub": "Lima WWTP → Ottawa River",
          "source": null,
          "warn": true
        }
      ],
      "gaps": [],
      "caveats": []
    }
  },
  {
    "chapter": "heat",
    "facility_key": "project-bosc",
    "lead_ids": [
      "THERMAL-NO-LIMIT"
    ],
    "model": {
      "id": "heat",
      "facilityKey": "project-bosc",
      "status": "data",
      "statusReasons": [],
      "stats": [
        {
          "label": "Thermal headroom at design low flow",
          "value": "5.4",
          "unit": "°C",
          "evidence": "inference",
          "basis": "modeled",
          "sub": "Ottawa River",
          "source": null,
          "warn": false
        },
        {
          "label": "Reach thermal capacity",
          "value": "0.1",
          "unit": "MW",
          "evidence": "inference",
          "basis": "modeled",
          "sub": null,
          "source": null,
          "warn": null
        }
      ],
      "gaps": [],
      "caveats": []
    }
  },
  {
    "chapter": "groundwater",
    "facility_key": "project-bosc",
    "lead_ids": [
      "DEWATERING-DRYWELL-NW"
    ],
    "model": {
      "id": "groundwater",
      "facilityKey": "project-bosc",
      "status": "data",
      "statusReasons": [],
      "stats": [],
      "gaps": [],
      "caveats": []
    }
  },
  {
    "chapter": "stormwater",
    "facility_key": "project-bosc",
    "lead_ids": [
      "ASWCD-PLANS",
      "ASWCD-04"
    ],
    "model": {
      "id": "stormwater",
      "facilityKey": "project-bosc",
      "status": "data",
      "statusReasons": [],
      "stats": [],
      "gaps": [],
      "caveats": []
    }
  },
  {
    "chapter": "air",
    "facility_key": "project-bosc",
    "lead_ids": [
      "PTI-313MW",
      "GH-160"
    ],
    "model": {
      "id": "air",
      "facilityKey": "project-bosc",
      "status": "data",
      "statusReasons": [],
      "stats": [],
      "gaps": [],
      "caveats": []
    }
  },
  {
    "chapter": "labor",
    "facility_key": "project-bosc",
    "lead_ids": [],
    "model": {
      "id": "labor",
      "facilityKey": "project-bosc",
      "status": "data",
      "statusReasons": [],
      "stats": [
        {
          "label": "County employment",
          "value": "49690",
          "unit": "jobs",
          "evidence": "verified",
          "basis": "grounded",
          "sub": "Allen County, Ohio · 2024",
          "source": "BLS QCEW",
          "warn": null
        }
      ],
      "gaps": [],
      "caveats": [
        "Any jobs claim reads against this baseline as claim vs. denominator — the study never computes a jobs multiplier."
      ]
    }
  },
  {
    "chapter": "power",
    "facility_key": "project-bosc",
    "lead_ids": [
      "PTI-313MW",
      "AEP-LYKA-OPSB"
    ],
    "model": {
      "id": "power",
      "facilityKey": "project-bosc",
      "status": "data",
      "statusReasons": [],
      "stats": [
        {
          "label": "Serving utility",
          "value": "AEP Ohio (Ohio Power Company)",
          "unit": null,
          "evidence": "verified",
          "basis": "grounded",
          "sub": "PJM Interconnection",
          "source": null,
          "warn": null
        },
        {
          "label": "Campus share of utility load",
          "value": "5.64%",
          "unit": null,
          "evidence": "inference",
          "basis": "modeled",
          "sub": "~348 MW disclosed campus draw",
          "source": null,
          "warn": null
        }
      ],
      "gaps": [],
      "caveats": [
        "The demand share and households-equivalent are the robust, EIA-cited headline; the price-pressure band is a STYLIZED screening sensitivity, not a forecast of retail bills.",
        "The campus buys at wholesale/industrial rates, not the residential price shown — residential price is the consumer-impact reference, not the campus bill.",
        "Facility draw is itself an assumption-laden estimate (air-permit IT load x PUE band, #87); the load factor and transmission coefficient are assumptions.",
        "Grid foundation layer (#94). The state, AEP Ohio (Ohio Power Company), and PJM denominators are now all connector-sourced — Ohio retail from EIA (shared with #91), per-utility retail from the EIA-861 file, and PJM annual demand from EIA-930. The campus is a single load equal to a material fraction of its serving utility's entire retail sales. Denominator vintages differ (utility EIA-861 2024 / BA EIA-930 2024 / state EIA 2025 (1-year spread)): the EIA state seriesid route publishes ahead of the EIA-861 bulk file and the EIA-930 annual sum, so the three shares are not struck against one common year."
      ]
    }
  },
  {
    "chapter": "fiscal",
    "facility_key": "project-bosc",
    "lead_ids": [
      "PRR-04",
      "GH-35"
    ],
    "model": {
      "id": "fiscal",
      "facilityKey": "project-bosc",
      "status": "gap",
      "statusReasons": [
        "no fiscal instrument is on the record"
      ],
      "stats": [],
      "gaps": [
        {
          "wouldScreen": "what tax revenue is being traded away and for how long, before the trade is approved.",
          "missingRecord": "the abatement agreement, the school-board resolution, and the county auditor's abatement report — all public records, none produced into this record.",
          "producer": "the county auditor, the school board, and the enterprise-zone/CRA agreement itself",
          "leadIds": [
            "PRR-04",
            "GH-35"
          ]
        }
      ],
      "caveats": []
    }
  },
  {
    "chapter": "balance",
    "facility_key": "project-bosc",
    "lead_ids": [],
    "model": {
      "id": "balance",
      "facilityKey": "project-bosc",
      "status": "data",
      "statusReasons": [],
      "stats": [],
      "gaps": [],
      "caveats": []
    }
  },
  {
    "chapter": "missing",
    "facility_key": "project-bosc",
    "lead_ids": [],
    "model": {
      "id": "missing",
      "facilityKey": "project-bosc",
      "status": "data",
      "statusReasons": [],
      "stats": [],
      "gaps": [],
      "caveats": []
    }
  }
]
