[
  {
    "chapter": "method",
    "facility_key": "project-zodiac",
    "lead_ids": [],
    "model": {
      "id": "method",
      "facilityKey": "project-zodiac",
      "status": "data",
      "statusReasons": [],
      "stats": [],
      "gaps": [],
      "caveats": []
    }
  },
  {
    "chapter": "project",
    "facility_key": "project-zodiac",
    "lead_ids": [],
    "model": {
      "id": "project",
      "facilityKey": "project-zodiac",
      "status": "data",
      "statusReasons": [],
      "stats": [
        {
          "label": "IT load",
          "value": "80–100",
          "unit": "MW",
          "evidence": "inference",
          "basis": "modeled",
          "sub": "bracket grounded by an instrument on the record",
          "source": "air permit (committed)",
          "warn": null
        },
        {
          "label": "Cooling",
          "value": "not disclosed",
          "unit": null,
          "evidence": "open",
          "basis": null,
          "sub": null,
          "source": null,
          "warn": null
        }
      ],
      "gaps": [],
      "caveats": []
    }
  },
  {
    "chapter": "assembly",
    "facility_key": "project-zodiac",
    "lead_ids": [],
    "model": {
      "id": "assembly",
      "facilityKey": "project-zodiac",
      "status": "partial",
      "statusReasons": [
        "the record carries no conveyance instrument — the land history has not been produced for this site"
      ],
      "stats": [],
      "gaps": [],
      "caveats": []
    }
  },
  {
    "chapter": "water-supply",
    "facility_key": "project-zodiac",
    "lead_ids": [],
    "model": {
      "id": "water-supply",
      "facilityKey": "project-zodiac",
      "status": "gap",
      "statusReasons": [
        "a disclosed cooling method and a metered or contracted water quantity; neither is on the record here."
      ],
      "stats": [],
      "gaps": [
        {
          "wouldScreen": "how much water this project consumes at buildout — monthly, against the receiving water's cited design low flows.",
          "missingRecord": "a disclosed cooling method and a metered or contracted water quantity; neither is on the record here.",
          "producer": "the water utility's contract, a wastewater permit application, or the operator's cooling-plant spec",
          "leadIds": null
        }
      ],
      "caveats": []
    }
  },
  {
    "chapter": "discharge",
    "facility_key": "project-zodiac",
    "lead_ids": [],
    "model": {
      "id": "discharge",
      "facilityKey": "project-zodiac",
      "status": "partial",
      "statusReasons": [
        "baseline context only — the project-side record has not been produced"
      ],
      "stats": [],
      "gaps": [],
      "caveats": [
        "Only the receiving water's existing burden is on the record here — the project-side discharge screen renders the day a characterization is filed."
      ]
    }
  },
  {
    "chapter": "heat",
    "facility_key": "project-zodiac",
    "lead_ids": [],
    "model": {
      "id": "heat",
      "facilityKey": "project-zodiac",
      "status": "gap",
      "statusReasons": [
        "a thermal characterization for this project — none exists on the record."
      ],
      "stats": [],
      "gaps": [
        {
          "wouldScreen": "how much heat the discharge adds to a reach screened against Ohio's numeric temperature criterion at its design low flows.",
          "missingRecord": "a thermal characterization for this project — none exists on the record.",
          "producer": "the NPDES application's thermal load sheet, or the permit's §316(a) demonstration",
          "leadIds": null
        }
      ],
      "caveats": []
    }
  },
  {
    "chapter": "groundwater",
    "facility_key": "project-zodiac",
    "lead_ids": [],
    "model": {
      "id": "groundwater",
      "facilityKey": "project-zodiac",
      "status": "data",
      "statusReasons": [],
      "stats": [],
      "gaps": [],
      "caveats": []
    }
  },
  {
    "chapter": "stormwater",
    "facility_key": "project-zodiac",
    "lead_ids": [],
    "model": {
      "id": "stormwater",
      "facilityKey": "project-zodiac",
      "status": "data",
      "statusReasons": [],
      "stats": [],
      "gaps": [],
      "caveats": []
    }
  },
  {
    "chapter": "air",
    "facility_key": "project-zodiac",
    "lead_ids": [],
    "model": {
      "id": "air",
      "facilityKey": "project-zodiac",
      "status": "gap",
      "statusReasons": [
        "an air-permit application for this project — none is on the record."
      ],
      "stats": [],
      "gaps": [
        {
          "wouldScreen": "the dispersion footprint of the campus's permitted backup-generator fleet.",
          "missingRecord": "an air-permit application for this project — none is on the record.",
          "producer": "the state air permit application (PTI/Title V) and its emissions tables",
          "leadIds": null
        }
      ],
      "caveats": []
    }
  },
  {
    "chapter": "labor",
    "facility_key": "project-zodiac",
    "lead_ids": [],
    "model": {
      "id": "labor",
      "facilityKey": "project-zodiac",
      "status": "data",
      "statusReasons": [],
      "stats": [
        {
          "label": "County employment",
          "value": "196725",
          "unit": "jobs",
          "evidence": "verified",
          "basis": "grounded",
          "sub": "Allen County, Indiana · 2023",
          "source": "BLS QCEW",
          "warn": null
        }
      ],
      "gaps": [],
      "caveats": [
        "Any jobs claim reads against this baseline as claim vs. denominator — the study never computes a jobs multiplier."
      ]
    }
  },
  {
    "chapter": "power",
    "facility_key": "project-zodiac",
    "lead_ids": [],
    "model": {
      "id": "power",
      "facilityKey": "project-zodiac",
      "status": "data",
      "statusReasons": [],
      "stats": [
        {
          "label": "Serving utility",
          "value": "Indiana Michigan Power Co",
          "unit": null,
          "evidence": "verified",
          "basis": "grounded",
          "sub": "PJM Interconnection",
          "source": null,
          "warn": null
        },
        {
          "label": "Campus share of utility load",
          "value": "6.15%",
          "unit": null,
          "evidence": "inference",
          "basis": "modeled",
          "sub": "~117 MW disclosed campus draw",
          "source": null,
          "warn": null
        }
      ],
      "gaps": [],
      "caveats": [
        "The demand share and households-equivalent are the robust, EIA-cited headline; the price-pressure band is a STYLIZED screening sensitivity, not a forecast of retail bills.",
        "The campus buys at wholesale/industrial rates, not the residential price shown — residential price is the consumer-impact reference, not the campus bill.",
        "Facility draw is itself an assumption-laden estimate (air-permit IT load x PUE band, #87); the load factor and transmission coefficient are assumptions.",
        "Grid foundation layer (#94). The state, Indiana Michigan Power Co, and PJM denominators are now all connector-sourced — Indiana retail from EIA (shared with #91), per-utility retail from the EIA-861 file, and PJM annual demand from EIA-930. The campus is a single load equal to a material fraction of its serving utility's entire retail sales. Denominator vintages differ (utility EIA-861 2024 / BA EIA-930 2024 / state EIA 2025 (1-year spread)): the EIA state seriesid route publishes ahead of the EIA-861 bulk file and the EIA-930 annual sum, so the three shares are not struck against one common year."
      ]
    }
  },
  {
    "chapter": "fiscal",
    "facility_key": "project-zodiac",
    "lead_ids": [],
    "model": {
      "id": "fiscal",
      "facilityKey": "project-zodiac",
      "status": "gap",
      "statusReasons": [
        "no fiscal instrument is on the record"
      ],
      "stats": [],
      "gaps": [
        {
          "wouldScreen": "what tax revenue is being traded away and for how long, before the trade is approved.",
          "missingRecord": "the abatement agreement, the school-board resolution, and the county auditor's abatement report — all public records, none produced into this record.",
          "producer": "the county auditor, the school board, and the enterprise-zone/CRA agreement itself",
          "leadIds": null
        }
      ],
      "caveats": []
    }
  },
  {
    "chapter": "governance",
    "facility_key": "project-zodiac",
    "lead_ids": [],
    "model": {
      "id": "governance",
      "facilityKey": "project-zodiac",
      "status": "partial",
      "statusReasons": [
        "the record carries no legislative instrument and no minutes — the decision path has not been produced for this site"
      ],
      "stats": [],
      "gaps": [],
      "caveats": []
    }
  },
  {
    "chapter": "balance",
    "facility_key": "project-zodiac",
    "lead_ids": [],
    "model": {
      "id": "balance",
      "facilityKey": "project-zodiac",
      "status": "partial",
      "statusReasons": [
        "synthesizes the screened chapters — 4 on the record, 1 partial, 3 gap"
      ],
      "stats": [],
      "gaps": [],
      "caveats": []
    }
  },
  {
    "chapter": "missing",
    "facility_key": "project-zodiac",
    "lead_ids": [],
    "model": {
      "id": "missing",
      "facilityKey": "project-zodiac",
      "status": "data",
      "statusReasons": [],
      "stats": [],
      "gaps": [],
      "caveats": []
    }
  }
]
